{
  "schemaVersion": "work-lab/future-candidate-registry/v1",
  "updatedAt": "2026-10-07",
  "governance": {
    "status_default": "DEFERRED",
    "default_enabled": false,
    "production_authorized": false,
    "intake": [
      "DISCOVER",
      "CLASSIFY",
      "NATIVE_OVERLAP",
      "LICENSE",
      "VERSION",
      "PERMISSION",
      "DATA_BOUNDARY",
      "WINDOWS_SUPPORT",
      "INSTALL_SIDE_EFFECT",
      "PILOT",
      "EVIDENCE",
      "DECISION"
    ],
    "decisions": [
      "PROMOTE",
      "KEEP_CANDIDATE",
      "REJECT"
    ],
    "note": "Every entry is a planning record only. This registry grants no install/download/clone/pilot permission. A pilot requires an individually authorized task card in taskpacks/current plus user authorization for each external side effect. Licenses marked NOT_VERIFIED must be verified during DISCOVER/CLASSIFY before any pilot. Rows retired on 2026-10-07 keep their reversal condition; nothing in this file authorizes an install, download, clone or pilot. 2026-10-09: this old candidate plan is FROZEN historical input, not the current task backlog. No install/deploy permission; selected capability evaluation now follows WUI-07/08.",
    "decisions_note": "Every candidate now carries one of governance.decisions plus the evidence the decision rests on: a discovery readback (RESOLVED with upstream and licence, AMBIGUOUS or NOT_FOUND with the searches that failed), a native_evidence list of repository paths that must exist, and an absorption level naming what is already in this codebase. REJECT is a dated retirement that keeps its reversal condition in pilot_trigger; it is not a deletion and it grants nothing. A licence verified from an upstream readback is recorded, never inferred, and copyleft or unlicensed rows are left as owner decisions rather than quietly adopted."
  },
  "candidates": [
    {
      "id": "FUT-001",
      "name": "Orca",
      "role": "Open-source heavy workspace / first Pilot candidate (GOAL 12)",
      "source": "https://github.com/stablyai/orca — GitHub API readback 2026-10-06: MIT, not archived, pushed 2026-10-06, 86448 stars",
      "license": "MIT",
      "windows_support": "LIKELY",
      "native_overlap": "provides terminal/worktree/file/diff/multi-agent UI; WORK-LAB keeps governance, tasks, context, evidence, permissions, coordination. Windows maturity is user-stated (GOAL 12) and unverified in this round; confirm during DISCOVER.",
      "integration_mode": "launch external workspace -> native Codex inside -> git/test/evidence -> WORK-LAB readback",
      "permissions": "no new global config; per-pilot user authorization for any external write",
      "data_boundary": "project-local; candidate must not spill into E:/F:/ or other projects",
      "status": "PILOT_CANDIDATE",
      "default_enabled": false,
      "pilot_trigger": "user-authorized Orca Pilot task card executed against a real project",
      "promotion_criteria": "PROMOTE only on the four REAL-evidence steps in the pilot card (project launch, worktree identity, task correlation, exit/readback) against a real external project, with WORK-LAB readback matching the task id and nothing promoted on a green badge alone.",
      "rejection_reason": null,
      "last_verified_at": "2026-10-07",
      "task_card": "taskpacks/history/pre-convergence-20261019/ORCA-PILOT-TASK-CARD-20260925.md",
      "blueprint_row": "16.01",
      "discovery": "RESOLVED",
      "upstream": "stablyai/orca",
      "license_spdx": "MIT",
      "windows_evidence": "README platform badge macOS|Windows|Linux and a published orca-windows-setup.exe asset (GitHub API 2026-10-06); not run on this machine, so not VERIFIED",
      "decision": "KEEP_CANDIDATE",
      "absorption": "NONE",
      "native_evidence": [
        "packages/client-neutral-core/scripts/adapter_sdk.py",
        "services/orchestration/worktree_manager.py",
        "packages/client-neutral-core/scripts/dispatch_contract.py",
        "packages/client-neutral-core/scripts/result_return.py",
        "taskpacks/history/pre-convergence-20261019/ORCA-PILOT-TASK-CARD-20260925.md"
      ],
      "decision_basis": "Row 16.01 triggers on an existing entry gap, and the gap is real: the adapter contract declares worktree_identity and remote_execution and GenericProcessAdapter only proves process presence, while nothing tracked launches an external workspace (no ShellExecute/open -a path exists in the repository). WORK-LAB keeps task, evidence and permission truth either way, so this stays a comparison and not a dependency. The card, not this row, owns the pilot.",
      "blocker": "The pilot's four steps each require launching and exiting a third-party desktop app plus a real external project; that is owner-side action with per-operation authorization, and the launch path itself does not exist yet in this repository."
    },
    {
      "id": "FUT-002",
      "name": "Omnigent",
      "role": "Machine orchestration layer candidate (GOAL 13; not a first Windows UI)",
      "source": "https://github.com/omnigent-ai/omnigent — GitHub API readback 2026-10-06: Apache-2.0, not archived, pushed 2026-10-06, 10622 stars",
      "license": "Apache-2.0",
      "windows_support": "LIKELY",
      "native_overlap": "Codex/Hermes/custom-agent session continuation + multi-agent orchestration; complements Orca (human workspace) as machine orchestration",
      "integration_mode": "future: WORK-LAB -> Omnigent (machine orchestration) + Orca (human workspace)",
      "permissions": "none until individually authorized",
      "data_boundary": "project-local; no new global config",
      "status": "REJECTED",
      "default_enabled": false,
      "pilot_trigger": "Reversal condition only: a measured task where the native fleet cannot dispatch, correlate or resume, with the failing path named in the error ledger.",
      "promotion_criteria": "Not promotable as recorded. Retirement is re-checkable, not a deletion: the reversal condition in pilot_trigger must be met with evidence, after which this row re-enters intake at DISCOVER with the identity read back again.",
      "rejection_reason": "discovery=RESOLVED, license verified, and the requirement is already native: the fleet registry loads five executor adapters, parallel dispatch isolates per-route failure under test, and thin_deployment forbids stacking a further task core. Adopting an external orchestrator would replace WORK task truth, which row 16.02 itself forbids.",
      "last_verified_at": "2026-10-07",
      "task_card": null,
      "blueprint_row": "16.02",
      "discovery": "RESOLVED",
      "upstream": "omnigent-ai/omnigent",
      "license_spdx": "Apache-2.0",
      "windows_evidence": "README states it runs natively on Windows in a degraded mode with one feature requiring WSL (GitHub API 2026-10-06)",
      "decision": "REJECT",
      "absorption": "NONE",
      "native_evidence": [
        "services/execution-federation/federation.py",
        "services/execution-federation/acp_adapter.py",
        "services/execution-federation/parallel_dispatch.py",
        "tests/workflow-assistance/test_parallel_dispatch.py",
        "tests/workflow-assistance/test_execution_federation.py",
        "packages/client-neutral-core/scripts/thin_deployment.py"
      ],
      "blocker": ""
    },
    {
      "id": "FUT-003",
      "name": "Argos",
      "role": "ACP/MCP/Skills/multi-model desktop control group (GOAL 14)",
      "source": "https://github.com/dvaJi/argos — GitHub API readback 2026-10-06: Apache-2.0, 3 stars, pushed 2026-09-20. The name matches several unrelated projects (translation, CI, 3D printing); this is the only one whose role matches row 16.03.",
      "license": "Apache-2.0",
      "windows_support": "LIKELY",
      "native_overlap": "ACP external runtime, MCP, Skills, Ollama/local providers; may replace Orca as the generic agent desktop if it fits better",
      "integration_mode": "control-group evaluation against Orca; candidate replacement, never permanent dependency",
      "permissions": "none until individually authorized",
      "data_boundary": "project-local",
      "status": "REJECTED",
      "default_enabled": false,
      "pilot_trigger": "Reversal condition only: an ACP/MCP/skills capability this upstream demonstrably provides and the native lane cannot, named file by file.",
      "promotion_criteria": "Not promotable as recorded. Retirement is re-checkable, not a deletion: the reversal condition in pilot_trigger must be met with evidence, after which this row re-enters intake at DISCOVER with the identity read back again.",
      "rejection_reason": "discovery=RESOLVED but the upstream carries three stars and the ACP/MCP/skills/multi-model lane it would supply is already native and tested (acp adapter contract, MCP declaration gate, canonical skill channel, model router plus capability matrix). Row 16.03 warns against a permanent default dependency; there is no net-new capability to justify one.",
      "last_verified_at": "2026-10-07",
      "task_card": null,
      "blueprint_row": "16.03",
      "discovery": "RESOLVED",
      "upstream": "dvaJi/argos",
      "license_spdx": "Apache-2.0",
      "windows_evidence": "README lists Windows/macOS/Linux and publishes a Windows .exe (GitHub API 2026-10-06)",
      "decision": "REJECT",
      "absorption": "NONE",
      "native_evidence": [
        "services/execution-federation/acp_adapter.py",
        "packages/client-neutral-core/scripts/mcp_gateway.py",
        "packages/client-neutral-core/scripts/canonical_skill.py",
        ".project/governance/model-capability-matrix.json",
        "packages/client-neutral-core/scripts/model_router.py"
      ],
      "blocker": ""
    },
    {
      "id": "FUT-004",
      "name": "OpenHands Agent Canvas",
      "role": "Open-source heavy workspace candidate (GOAL 11 first group)",